{
  "id": "fee/scale-cap-1b",
  "title": "Максимум пошлины по имущественному иску — 900 000 ₽",
  "description": "Цена иска 1 000 000 000 ₽, физическое лицо, первая инстанция, без соединённых требований.",
  "legal_basis": [
    "пп. 1 п. 1 ст. 333.19 НК РФ (ред. ФЗ от 08.08.2024 № 259-ФЗ)"
  ],
  "kind": "court_fee",
  "status": "draft",
  "source_note": "Арифметика по шкале ст. 333.19 НК РФ; сверить с официальным калькулятором ВС РФ (vsrf.ru/lk/calculator/list) перед переводом в confirmed.",
  "input": {
    "claim_price": 1000000000,
    "plaintiff_type": "individual",
    "filed_at": "2025-06-01"
  },
  "expected": {
    "court_fee": 900000,
    "breakdown": [
      {
        "item": "property_claim",
        "amount": 900000,
        "basis": "пп. 1 п. 1 ст. 333.19 НК РФ (ред. ФЗ от 08.08.2024 № 259-ФЗ)"
      }
    ]
  }
}
