{
  "id": "fee/appeal-3000",
  "title": "Апелляционная жалоба — 3 000 ₽ для физического лица",
  "description": "На стадии апелляции вместо шкалы имущественного иска уплачивается фиксированная пошлина.",
  "legal_basis": ["ст. 333.19 НК РФ — апелляционная жалоба"],
  "kind": "court_fee",
  "status": "draft",
  "source_note": "Фиксированный размер с 09.09.2024. Сверить подпункт статьи по действующей редакции.",
  "input": {
    "claim_price": 5000000,
    "plaintiff_type": "individual",
    "stage": "appeal",
    "filed_at": "2025-06-01"
  },
  "expected": {
    "court_fee": 3000,
    "breakdown": [
      { "item": "appeal", "amount": 3000, "basis": "ст. 333.19 НК РФ — апелляционная жалоба, 3 000 ₽" }
    ]
  }
}
