{
  "id": "fee/prior-right-established",
  "title": "Право собственности истца ранее признано судом — фиксированная пошлина",
  "description": "Если спор о признании права собственности истца на имущество ранее решён судом, пошлина уплачивается как по имущественному требованию, не подлежащему оценке: 3 000 ₽ для физических лиц, независимо от цены иска.",
  "legal_basis": [
    "пп. 3 п. 1 ст. 333.20 НК РФ",
    "пп. 3 п. 1 ст. 333.19 НК РФ — 3 000 ₽ для физических лиц"
  ],
  "kind": "court_fee",
  "status": "draft",
  "source_note": "Арифметика по шкале ст. 333.19 НК РФ; сверить с официальным калькулятором ВС РФ (vsrf.ru/lk/calculator/list) перед переводом в confirmed.",
  "input": {
    "claim_price": 5000000,
    "plaintiff_type": "individual",
    "prior_right_established": true,
    "filed_at": "2025-06-01"
  },
  "expected": {
    "court_fee": 3000,
    "breakdown": [
      {
        "item": "property_claim_fixed",
        "amount": 3000,
        "basis": "пп. 3 п. 1 ст. 333.20 → пп. 3 п. 1 ст. 333.19 НК РФ"
      }
    ]
  }
}
