{
  "id": "division/acquired-after-separation",
  "title": "Имущество после фактического прекращения отношений не входит в массу без явной позиции",
  "description": "Разъезд 2024-03-01. Квартира куплена до разъезда — в массе. Вклад открыт после разъезда: include = true, но accepted_position нет — вне массы, предупреждение. Проверяет п. 4 ст. 38 СК РФ / п. 16 Пленума № 15.",
  "legal_basis": [
    "п. 4 ст. 38 СК РФ",
    "п. 16 Постановления Пленума ВС РФ от 05.11.1998 № 15"
  ],
  "kind": "division",
  "status": "draft",
  "source_note": "Синтетический кейс.",
  "input": {
    "scenario_id": "s-claim",
    "case": {
      "schema_version": 2,
      "regime": "ru_community_property",
      "facts": {
        "marriage": { "registered_at": "2010-01-15" },
        "separated_at": "2024-03-01",
        "dissolved_at": "2024-12-01",
        "contract": { "exists": false },
        "agreement": { "exists": false },
        "parties": { "wife_person_guid": null, "husband_person_guid": null, "our_client": "wife", "plaintiff": "wife" },
        "children": []
      },
      "assets": [
        {
          "id": "a-flat",
          "kind": "apartment",
          "title": "Квартира до разъезда",
          "title_holder": "joint",
          "acquired_at": "2019-06-01",
          "positions": {
            "wife": { "position": "common" },
            "husband": { "position": "common" }
          },
          "valuations": [
            { "id": "v-flat", "type": "appraiser", "amount": 5000000, "currency": "RUB" }
          ]
        },
        {
          "id": "a-deposit",
          "kind": "deposit",
          "title": "Вклад после разъезда",
          "title_holder": "husband",
          "acquired_at": "2024-06-15",
          "positions": {
            "wife": { "position": "common" },
            "husband": { "position": "personal_husband", "ground": "открыт после прекращения отношений" }
          },
          "valuations": [
            { "id": "v-dep", "type": "party_wife", "amount": 1000000, "currency": "RUB" }
          ]
        }
      ],
      "liabilities": [],
      "scenarios": [
        {
          "id": "s-claim",
          "title": "Иск",
          "kind": "claim",
          "is_primary": true,
          "wife_share": 0.5,
          "valuation_policy": "per_item",
          "asset_items": [
            { "asset_id": "a-flat", "include": true, "valuation_id": "v-flat", "assigned_to": "wife" },
            { "asset_id": "a-deposit", "include": true, "valuation_id": "v-dep", "assigned_to": "husband" }
          ],
          "liability_items": [],
          "claim": { "plaintiff": "wife" }
        }
      ]
    }
  },
  "expected": {
    "mass": { "assets_common": 5000000, "liabilities_common": 0, "net": 5000000 },
    "ideal": { "wife": 2500000, "husband": 2500000 },
    "received": {
      "assets": { "wife": 5000000, "husband": 0 },
      "liabilities": { "wife": 0, "husband": 0 },
      "net": { "wife": 5000000, "husband": 0 }
    },
    "unallocated": 0,
    "compensation": { "from": "wife", "to": "husband", "amount": 2500000 },
    "warnings": ["asset.acquired_after_separation"]
  }
}
