{
  "id": "division/dual-valuation-sold-car",
  "title": "Отчуждённый автомобиль: оценка стороны и суда, add-back за отчуждателем",
  "description": "Обезличенный сценарий: автомобиль оформлен на третье лицо и отчуждён супругом без согласия. Супруга оценивает 6 175 000 ₽, суд — 4 270 000 ₽. Сценарий берёт судебную оценку и учитывает объект за супругом (add-back). Второй автомобиль 2 820 000 ₽ тоже супругу. Компенсация супруге — половина массы.",
  "legal_basis": [
    "п. 16 Постановления Пленума ВС РФ от 05.11.1998 № 15",
    "п. 15 Постановления Пленума ВС РФ № 15 — стоимость на время рассмотрения"
  ],
  "kind": "division",
  "status": "draft",
  "source_note": "Синтетические суммы по мотивам спора об отчуждённом автомобиле. Идентификаторы ТС и ФИО не используются.",
  "input": {
    "scenario_id": "s-claim",
    "case": {
      "schema_version": 2,
      "regime": "ru_community_property",
      "facts": {
        "marriage": { "registered_at": "2016-07-01" },
        "separated_at": "2025-03-25",
        "dissolved_at": "2025-09-02",
        "contract": { "exists": false },
        "agreement": { "exists": false },
        "parties": { "wife_person_guid": null, "husband_person_guid": null, "our_client": "wife", "plaintiff": "wife" },
        "children": []
      },
      "assets": [
        {
          "id": "a-sold-car",
          "kind": "vehicle",
          "title": "Автомобиль, отчуждённый без согласия",
          "title_holder": "third_party",
          "acquired_at": "2023-04-01",
          "disposed": { "at": "2025-06-01", "by": "husband", "spouse_consent": false, "proceeds_use": "personal" },
          "positions": {
            "wife": { "position": "common", "ground": "куплен в браке на общие средства и отчуждён без согласия" },
            "husband": { "position": "personal_husband", "ground": "куплен на личные средства" }
          },
          "valuations": [
            { "id": "v-wife", "type": "party_wife", "amount": 6175000, "currency": "RUB" },
            { "id": "v-court", "type": "court", "amount": 4270000, "currency": "RUB", "accepted_by_court": true }
          ]
        },
        {
          "id": "a-car-2",
          "kind": "vehicle",
          "title": "Второй автомобиль",
          "title_holder": "wife",
          "acquired_at": "2021-06-01",
          "positions": {
            "wife": { "position": "common" },
            "husband": { "position": "common" }
          },
          "valuations": [
            { "id": "v-car-2", "type": "court", "amount": 2820000, "currency": "RUB", "accepted_by_court": true }
          ]
        }
      ],
      "liabilities": [],
      "scenarios": [
        {
          "id": "s-claim",
          "title": "Иск супруги, судебные оценки",
          "kind": "claim",
          "is_primary": true,
          "wife_share": 0.5,
          "valuation_policy": "per_item",
          "asset_items": [
            { "asset_id": "a-sold-car", "include": true, "valuation_id": "v-court", "accepted_position": "common", "add_back": true, "assigned_to": "husband" },
            { "asset_id": "a-car-2", "include": true, "valuation_id": "v-car-2", "assigned_to": "husband" }
          ],
          "liability_items": [],
          "claim": { "plaintiff": "wife", "plaintiff_type": "individual" }
        }
      ]
    }
  },
  "expected": {
    "mass": { "assets_common": 7090000, "liabilities_common": 0, "net": 7090000 },
    "ideal": { "wife": 3545000, "husband": 3545000 },
    "received": {
      "assets": { "wife": 0, "husband": 7090000 },
      "liabilities": { "wife": 0, "husband": 0 },
      "net": { "wife": 0, "husband": 7090000 }
    },
    "unallocated": 0,
    "compensation": { "from": "husband", "to": "wife", "amount": 3545000 },
    "claim_price": 3545000,
    "warnings": ["asset.disposed_without_evidence"]
  }
}
