{
  "id": "fee/with-injunction-5m",
  "title": "Раздел имущества на 5 000 000 ₽ + заявление об обеспечении иска",
  "description": "Заявление об обеспечении иска оплачивается отдельно — 10 000 ₽.",
  "legal_basis": [
    "пп. 1 п. 1 ст. 333.19 НК РФ (ред. ФЗ от 08.08.2024 № 259-ФЗ)",
    "п. 1 ст. 333.19 НК РФ — заявление об обеспечении иска, 10 000 ₽"
  ],
  "kind": "court_fee",
  "status": "draft",
  "source_note": "Арифметика по шкале ст. 333.19 НК РФ; сверить с официальным калькулятором ВС РФ (vsrf.ru/lk/calculator/list) перед переводом в confirmed. Подпункт про обеспечение иска указать по действующей редакции.",
  "input": {
    "claim_price": 5000000,
    "plaintiff_type": "individual",
    "injunction_requested": true,
    "filed_at": "2025-06-01"
  },
  "expected": {
    "court_fee": 69000,
    "breakdown": [
      {
        "item": "property_claim",
        "amount": 59000,
        "basis": "пп. 1 п. 1 ст. 333.19 НК РФ (ред. ФЗ от 08.08.2024 № 259-ФЗ)"
      },
      {
        "item": "injunction",
        "amount": 10000,
        "basis": "ст. 333.19 НК РФ — заявление об обеспечении иска"
      }
    ]
  }
}
