{
  "id": "fee/with-divorce-5m",
  "title": "Раздел имущества на 5 000 000 ₽ + требование о расторжении брака",
  "description": "При соединении требований пошлина по имущественному требованию и по требованию о расторжении брака суммируется.",
  "legal_basis": [
    "пп. 1 п. 1 ст. 333.19 НК РФ (ред. ФЗ от 08.08.2024 № 259-ФЗ)",
    "пп. 5 п. 1 ст. 333.19 НК РФ — расторжение брака 5 000 ₽",
    "п. 12 ст. 333.20 НК РФ — соединение требований"
  ],
  "kind": "court_fee",
  "status": "draft",
  "source_note": "Арифметика по шкале ст. 333.19 НК РФ; сверить с официальным калькулятором ВС РФ (vsrf.ru/lk/calculator/list) перед переводом в confirmed.",
  "input": {
    "claim_price": 5000000,
    "plaintiff_type": "individual",
    "divorce_claimed": true,
    "filed_at": "2025-06-01"
  },
  "expected": {
    "court_fee": 64000,
    "breakdown": [
      {
        "item": "property_claim",
        "amount": 59000,
        "basis": "пп. 1 п. 1 ст. 333.19 НК РФ (ред. ФЗ от 08.08.2024 № 259-ФЗ)"
      },
      {
        "item": "divorce",
        "amount": 5000,
        "basis": "пп. 5 п. 1 ст. 333.19 НК РФ"
      }
    ]
  }
}
