{
  "id": "fee/cassation-5000",
  "title": "Кассационная жалоба — 5 000 ₽ для физического лица",
  "description": "На стадии кассации вместо шкалы имущественного иска уплачивается фиксированная пошлина.",
  "legal_basis": ["ст. 333.19 НК РФ — кассационная жалоба"],
  "kind": "court_fee",
  "status": "draft",
  "source_note": "Фиксированный размер с 09.09.2024. Сверить подпункт статьи по действующей редакции.",
  "input": {
    "claim_price": 5000000,
    "plaintiff_type": "individual",
    "stage": "cassation",
    "filed_at": "2025-06-01"
  },
  "expected": {
    "court_fee": 5000,
    "breakdown": [
      { "item": "cassation", "amount": 5000, "basis": "ст. 333.19 НК РФ — кассационная жалоба, 5 000 ₽" }
    ]
  }
}
